{
  "schema_version": 1,
  "fixture_id": "gen-kta-pos-003",
  "suites": [
    "know-to-ask",
    "push"
  ],
  "category": "kta-pos",
  "seed_pages": [
    {
      "slug": "people/tobias-cindergate",
      "content": "---\ntitle: Tobias Cindergate\ntype: person\naliases: [tobias]\nsummary: Founder of Mosslight.\n---\n\nTobias Cindergate is the founder of Mosslight. Tobias raised concerns about gross margin at the last board sync.\n"
    },
    {
      "slug": "companies/mosslight",
      "content": "---\ntitle: Mosslight\ntype: company\nsummary: Seed-stage company. Founded by Tobias Cindergate.\n---\n\nMosslight is a seed-stage company. Founded by Tobias Cindergate. The seed conversation started in 2025.\n"
    }
  ],
  "turns": [
    {
      "turn_id": 1,
      "role": "user",
      "text": "I'm meeting Tobias tomorrow — anything I should remember?"
    },
    {
      "turn_id": 2,
      "role": "assistant",
      "text": "Here is what I have."
    },
    {
      "turn_id": 3,
      "role": "user",
      "text": "Great, thanks. That covers it."
    }
  ]
}
