{
  "schema_version": 1,
  "fixture_id": "gen-wb-007",
  "suites": [
    "write-back"
  ],
  "category": "write-back",
  "seed_pages": [
    {
      "slug": "people/caspian-ironwood",
      "content": "---\ntitle: Caspian Ironwood\ntype: person\naliases: [caspian]\nsummary: Founder of Umbergale Labs.\n---\n\nCaspian Ironwood is the founder of Umbergale Labs. Caspian flagged churn as the top risk in the latest update.\n"
    },
    {
      "slug": "companies/umbergale-labs",
      "content": "---\ntitle: Umbergale Labs\ntype: company\nsummary: Seed-stage company. Founded by Caspian Ironwood.\n---\n\nUmbergale Labs is a seed-stage company. Founded by Caspian Ironwood. The seed conversation started in 2025.\n"
    }
  ],
  "turns": [
    {
      "turn_id": 1,
      "role": "user",
      "text": "Just wrapped the Umbergale Labs call with Caspian Ironwood.",
      "ts": "2026-07-24T15:34:00Z"
    },
    {
      "turn_id": 2,
      "role": "assistant",
      "text": "How did it go?",
      "ts": "2026-07-24T15:35:00Z"
    },
    {
      "turn_id": 3,
      "role": "user",
      "text": "Caspian said Umbergale Labs hit their growth target a month early. Ahead of plan.",
      "ts": "2026-07-24T16:21:00Z"
    },
    {
      "turn_id": 4,
      "role": "user",
      "text": "Caspian is worried the Umbergale Labs pricing model undercuts their gross margin. Real concern for the round.",
      "ts": "2026-07-24T16:22:00Z"
    }
  ]
}
