{
  "schema_version": 1,
  "fixture_id": "gen-kta-pos-015",
  "suites": [
    "know-to-ask",
    "push"
  ],
  "category": "kta-pos",
  "seed_pages": [
    {
      "slug": "people/halcyon-quillfeather",
      "content": "---\ntitle: Halcyon Quillfeather\ntype: person\naliases: [halcyon]\nsummary: Founder of Quartzbloom Systems.\n---\n\nHalcyon Quillfeather is the founder of Quartzbloom Systems. Halcyon pushed back on the proposed valuation during diligence.\n"
    },
    {
      "slug": "companies/quartzbloom-systems",
      "content": "---\ntitle: Quartzbloom Systems\ntype: company\nsummary: Seed-stage company. Founded by Halcyon Quillfeather.\n---\n\nQuartzbloom Systems is a seed-stage company. Founded by Halcyon Quillfeather. The seed conversation started in 2025.\n"
    }
  ],
  "turns": [
    {
      "turn_id": 1,
      "role": "user",
      "text": "Did Quillfeather ever follow up on that intro?"
    },
    {
      "turn_id": 2,
      "role": "assistant",
      "text": "Here is what I have."
    },
    {
      "turn_id": 3,
      "role": "user",
      "text": "Great, thanks. That covers it."
    }
  ]
}
