{
  "schema_version": 1,
  "fixture_id": "gen-wb-019",
  "suites": [
    "write-back"
  ],
  "category": "write-back",
  "seed_pages": [
    {
      "slug": "people/mateo-glimmerton",
      "content": "---\ntitle: Mateo Glimmerton\ntype: person\naliases: [mateo]\nsummary: Founder of Kelpforge.\n---\n\nMateo Glimmerton is the founder of Kelpforge. Mateo shipped the v2 launch two weeks ahead of plan.\n"
    },
    {
      "slug": "companies/kelpforge",
      "content": "---\ntitle: Kelpforge\ntype: company\nsummary: Seed-stage company. Founded by Mateo Glimmerton.\n---\n\nKelpforge is a seed-stage company. Founded by Mateo Glimmerton. The seed conversation started in 2025.\n"
    }
  ],
  "turns": [
    {
      "turn_id": 1,
      "role": "user",
      "text": "Just wrapped the Kelpforge call with Mateo Glimmerton.",
      "ts": "2026-10-08T12:09:00Z"
    },
    {
      "turn_id": 2,
      "role": "assistant",
      "text": "How did it go?",
      "ts": "2026-10-08T12:10:00Z"
    },
    {
      "turn_id": 3,
      "role": "user",
      "text": "Mateo said Kelpforge hit their growth target a month early. Ahead of plan.",
      "ts": "2026-10-08T12:56:00Z"
    },
    {
      "turn_id": 4,
      "role": "user",
      "text": "I committed to sending Mateo the diligence checklist by Friday.",
      "ts": "2026-10-08T12:57:00Z"
    }
  ]
}
