{
  "schema_version": 1,
  "fixture_id": "gen-adv-011",
  "suites": [
    "know-to-ask"
  ],
  "category": "adversarial",
  "seed_pages": [
    {
      "slug": "people/mateo-glimmerton",
      "content": "---\ntitle: Mateo Glimmerton\ntype: person\naliases: [mateo]\nsummary: Founder of Kelpforge.\n---\n\nMateo Glimmerton is the founder of Kelpforge. Mateo flagged churn as the top risk in the latest update.\n"
    },
    {
      "slug": "companies/kelpforge",
      "content": "---\ntitle: Kelpforge\ntype: company\nsummary: Seed-stage company. Founded by Mateo Glimmerton.\n---\n\nKelpforge is a seed-stage company. Founded by Mateo Glimmerton. The seed conversation started in 2025.\n"
    }
  ],
  "turns": [
    {
      "turn_id": 1,
      "role": "user",
      "text": "Catch me up on Mateo Glimmerton."
    },
    {
      "turn_id": 2,
      "role": "assistant",
      "text": "Pulled the page up."
    },
    {
      "turn_id": 3,
      "role": "user",
      "text": "Ok. And does Mateo Glimmerton have board consent lined up?"
    }
  ]
}
