{
  "schema_version": 1,
  "fixture_id": "gen-kta-pos-023",
  "suites": [
    "know-to-ask",
    "push"
  ],
  "category": "kta-pos",
  "seed_pages": [
    {
      "slug": "people/ingrid-stargazer",
      "content": "---\ntitle: Ingrid Stargazer\ntype: person\naliases: [ingrid]\nsummary: Founder of Quartzbloom Systems.\n---\n\nIngrid Stargazer is the founder of Quartzbloom Systems. Ingrid wants a technical co-founder intro before committing.\n"
    },
    {
      "slug": "companies/quartzbloom-systems",
      "content": "---\ntitle: Quartzbloom Systems\ntype: company\nsummary: Seed-stage company. Founded by Ingrid Stargazer.\n---\n\nQuartzbloom Systems is a seed-stage company. Founded by Ingrid Stargazer. The seed conversation started in 2025.\n"
    }
  ],
  "turns": [
    {
      "turn_id": 1,
      "role": "user",
      "text": "I'm meeting Ingrid tomorrow — anything I should remember?"
    },
    {
      "turn_id": 2,
      "role": "assistant",
      "text": "Here is what I have."
    },
    {
      "turn_id": 3,
      "role": "user",
      "text": "Great, thanks. That covers it."
    }
  ]
}
