{
  "schema_version": 1,
  "fixture_id": "gen-cont-008-reader",
  "suites": [
    "continuity"
  ],
  "category": "continuity",
  "turns": [
    {
      "turn_id": 1,
      "role": "user",
      "text": "Where did we land on Saplingrove Works?"
    }
  ],
  "continuity": {
    "pair_id": "gen-cont-008",
    "pair_role": "reader"
  }
}
