{
  "schema_version": 1,
  "fixture_id": "gen-push-008",
  "suites": [
    "know-to-ask",
    "push"
  ],
  "category": "push",
  "seed_pages": [
    {
      "slug": "people/saoirse-oakhurst",
      "content": "---\ntitle: Saoirse Oakhurst\ntype: person\naliases: [saoirse]\nsummary: Founder of Driftspark Works.\n---\n\nSaoirse Oakhurst is the founder of Driftspark Works. Saoirse shipped the v2 launch two weeks ahead of plan.\n"
    },
    {
      "slug": "people/anneke-veldenmere",
      "content": "---\ntitle: Anneke Veldenmere\ntype: person\naliases: [anneke]\nsummary: Founder of Marblepond Labs.\n---\n\nAnneke Veldenmere is the founder of Marblepond Labs. Anneke shipped the v2 launch two weeks ahead of plan.\n"
    },
    {
      "slug": "companies/driftspark-works",
      "content": "---\ntitle: Driftspark Works\ntype: company\nsummary: Seed-stage company. Founded by Saoirse Oakhurst.\n---\n\nDriftspark Works is a seed-stage company. Founded by Saoirse Oakhurst. The seed conversation started in 2025.\n"
    },
    {
      "slug": "funds/brightmoor-ventures",
      "content": "---\ntitle: Brightmoor Ventures\ntype: org\nsummary: Early-stage fund that co-invests on seed rounds.\n---\n\nBrightmoor Ventures is an early-stage fund that co-invests on seed rounds.\n"
    }
  ],
  "turns": [
    {
      "turn_id": 1,
      "role": "user",
      "text": "Draft a memo for the partner meeting: Saoirse Oakhurst and Anneke Veldenmere both want Brightmoor Ventures in the Driftspark Works round."
    },
    {
      "turn_id": 2,
      "role": "assistant",
      "text": "Drafting now."
    },
    {
      "turn_id": 3,
      "role": "user",
      "text": "Make the memo lead with traction, then risks, then the ask."
    }
  ]
}
