{
  "schema_version": 1,
  "fixture_id": "gen-kta-pos-009",
  "suites": [
    "know-to-ask",
    "push"
  ],
  "category": "kta-pos",
  "seed_pages": [
    {
      "slug": "people/cosmo-hollybrook",
      "content": "---\ntitle: Cosmo Hollybrook\ntype: person\naliases: [cosmo]\nsummary: Founder of Skylarkift.\n---\n\nCosmo Hollybrook is the founder of Skylarkift. Cosmo pushed back on the proposed valuation during diligence.\n"
    },
    {
      "slug": "companies/skylarkift",
      "content": "---\ntitle: Skylarkift\ntype: company\nsummary: Seed-stage company. Founded by Cosmo Hollybrook.\n---\n\nSkylarkift is a seed-stage company. Founded by Cosmo Hollybrook. The seed conversation started in 2025.\n"
    }
  ],
  "turns": [
    {
      "turn_id": 1,
      "role": "user",
      "text": "remind me what cosmo said about the round"
    },
    {
      "turn_id": 2,
      "role": "assistant",
      "text": "Here is what I have."
    },
    {
      "turn_id": 3,
      "role": "user",
      "text": "Great, thanks. That covers it."
    }
  ]
}
