{
  "schema_version": 1,
  "fixture_id": "gen-push-010",
  "suites": [
    "know-to-ask",
    "push"
  ],
  "category": "push",
  "seed_pages": [
    {
      "slug": "people/beatrix-larkmoor",
      "content": "---\ntitle: Beatrix Larkmoor\ntype: person\naliases: [beatrix]\nsummary: Founder of Marblepond Labs.\n---\n\nBeatrix Larkmoor is the founder of Marblepond Labs. Beatrix wants a technical co-founder intro before committing.\n"
    },
    {
      "slug": "people/dmitri-brackenbury",
      "content": "---\ntitle: Dmitri Brackenbury\ntype: person\naliases: [dmitri]\nsummary: Founder of Windrose.\n---\n\nDmitri Brackenbury is the founder of Windrose. Dmitri wants a technical co-founder intro before committing.\n"
    },
    {
      "slug": "companies/marblepond-labs",
      "content": "---\ntitle: Marblepond Labs\ntype: company\nsummary: Seed-stage company. Founded by Beatrix Larkmoor.\n---\n\nMarblepond Labs is a seed-stage company. Founded by Beatrix Larkmoor. The seed conversation started in 2025.\n"
    },
    {
      "slug": "funds/willowmere-partners",
      "content": "---\ntitle: Willowmere Partners\ntype: org\nsummary: Early-stage fund that co-invests on seed rounds.\n---\n\nWillowmere Partners is an early-stage fund that co-invests on seed rounds.\n"
    }
  ],
  "turns": [
    {
      "turn_id": 1,
      "role": "user",
      "text": "Draft a memo for the partner meeting: Beatrix Larkmoor and Dmitri Brackenbury both want Willowmere Partners in the Marblepond Labs round."
    },
    {
      "turn_id": 2,
      "role": "assistant",
      "text": "Drafting now."
    },
    {
      "turn_id": 3,
      "role": "user",
      "text": "Make the memo lead with traction, then risks, then the ask."
    }
  ]
}
