{
  "schema_version": 1,
  "fixture_id": "gen-push-016",
  "suites": [
    "know-to-ask",
    "push"
  ],
  "category": "push",
  "seed_pages": [
    {
      "slug": "people/bastian-rookswood",
      "content": "---\ntitle: Bastian Rookswood\ntype: person\naliases: [bastian]\nsummary: Founder of Skylarkift.\n---\n\nBastian Rookswood is the founder of Skylarkift. Bastian flagged churn as the top risk in the latest update.\n"
    },
    {
      "slug": "people/tamsin-windermoor",
      "content": "---\ntitle: Tamsin Windermoor\ntype: person\naliases: [tamsin]\nsummary: Founder of Cloudmeadow Works.\n---\n\nTamsin Windermoor is the founder of Cloudmeadow Works. Tamsin flagged churn as the top risk in the latest update.\n"
    },
    {
      "slug": "companies/skylarkift",
      "content": "---\ntitle: Skylarkift\ntype: company\nsummary: Seed-stage company. Founded by Bastian Rookswood.\n---\n\nSkylarkift is a seed-stage company. Founded by Bastian Rookswood. The seed conversation started in 2025.\n"
    },
    {
      "slug": "funds/cinderpath-capital",
      "content": "---\ntitle: Cinderpath Capital\ntype: org\nsummary: Early-stage fund that co-invests on seed rounds.\n---\n\nCinderpath Capital is an early-stage fund that co-invests on seed rounds.\n"
    }
  ],
  "turns": [
    {
      "turn_id": 1,
      "role": "user",
      "text": "Draft a memo for the partner meeting: Bastian Rookswood and Tamsin Windermoor both want Cinderpath Capital in the Skylarkift round."
    },
    {
      "turn_id": 2,
      "role": "assistant",
      "text": "Drafting now."
    },
    {
      "turn_id": 3,
      "role": "user",
      "text": "Make the memo lead with traction, then risks, then the ask."
    }
  ],
  "holdout": true
}
